{
  "$schema": "https://json-schema.org/draft/2020-12/schema",
  "type": "object",
  "required": [
    "dataset",
    "as_of",
    "version",
    "records"
  ],
  "properties": {
    "dataset": {
      "const": "project_updates"
    },
    "as_of": {
      "type": "string"
    },
    "version": {
      "type": "integer"
    },
    "records": {
      "type": "array",
      "items": {
        "type": "object",
        "required": [
          "update_id",
          "project_id",
          "date",
          "title",
          "kind",
          "status",
          "summary",
          "related_proposals",
          "related_addresses",
          "links",
          "notes"
        ],
        "properties": {
          "update_id": {
            "type": "string"
          },
          "project_id": {
            "type": "string"
          },
          "date": {
            "type": "string"
          },
          "title": {
            "type": "string"
          },
          "kind": {
            "type": "string"
          },
          "status": {
            "type": "string"
          },
          "summary": {
            "type": "string"
          },
          "related_proposals": {
            "type": "array",
            "items": {
              "type": "string"
            }
          },
          "related_addresses": {
            "type": "array",
            "items": {
              "type": "string"
            }
          },
          "links": {
            "type": "array",
            "items": {
              "type": "string"
            }
          },
          "notes": {
            "type": "string"
          }
        },
        "additionalProperties": false
      }
    }
  },
  "additionalProperties": false
}
